<?xml version="1.0"?>
<?xml-stylesheet type="text/xsl" href="../css/strict.xsl"?>
<PAGE xmlns:xsi="http://www.w3.org/2001/XMLSchema-instance" xsi:noNamespaceSchemaLocation="../css/schema.xsd" xml:lang="fr">
<TITLE>Cake aux lardons, poulet et olives</TITLE>
<PATH>bouffe/0119.xml</PATH>
<DATE><YEAR>2010</YEAR><MONTH>10</MONTH><DAY>25</DAY></DATE>
<CONTENT>
<SLIST>
  <ITEM>préparation : 20 min</ITEM>
  <ITEM>cuisson : 45 min</ITEM>
</SLIST>
<LINE/>
<BLIST><TITLE>Pour 8 personnes</TITLE>
  <ITEM>100g de blanc de poulet cuit</ITEM>
  <ITEM>100g de lardons fumés</ITEM>
  <ITEM>100g de champignons de Paris</ITEM>
  <ITEM>20 olives noires dénoyautées</ITEM>
  <ITEM>1 cuil. à soupe de persil haché</ITEM>
  <ITEM>225g de farine + 10g</ITEM>
  <ITEM>100g de beurre + 15g</ITEM>
  <ITEM>4 œufs</ITEM>
  <ITEM>1/2 paquet de levure chimique</ITEM>
  <ITEM>10cl de vin blanc sec</ITEM>
  <ITEM>1 cuil. à soupe d’huile d’arachide</ITEM>
  <ITEM>1/2 cuil. à café de sel</ITEM>
</BLIST>
<LINE/>
<BLIST>
  <ITEM>Allumez le four th. 6-7 (200°C). Beurrez et farinez un moule à cake. Coupez les olives en morceaux. Émincez le poulet en lamelles. Faites fondre le beurre.</ITEM>
  <ITEM>Dorez les lardons dans une cuillerée d’huile à la poêle. Réservez. Nettoyez et émincez les champignons. Faites-les revenir à la poêle avec une pincée de sel jusqu’à ce qu’ils rendent leur eau. Versez en passoire.</ITEM>
  <ITEM>Dans un saladier, mêlez la farine, le sel et la levure. Creusez au centre et cassez-y les œufs. Mélangez à la cuillère en bois en incorporant peu à peu la farine, tout en versant progressivement le beurre fondu puis le vin. Ajoutez persil, olives, poulet, lardons et champignons à la pâte, puis versez-la dans le moule.</ITEM>
  <ITEM>Cuisez 45 min. Vérifiez en enfonçant une brochette au centre, elle doit ressortir sèche. Laissez tiédir 5 min avant de démouler et laissez refroidir sur une grille.</ITEM>
</BLIST>
<I><U>source :</U> Cuisine Actuelle - Hors-Série juin-juillet 2004 - page 42</I>
</CONTENT>
</PAGE>