<?xml version="1.0"?>
<?xml-stylesheet type="text/xsl" href="../css/strict.xsl"?>
<PAGE xmlns:xsi="http://www.w3.org/2001/XMLSchema-instance" xsi:noNamespaceSchemaLocation="../css/schema.xsd">
<TITLE>Chou blanc à la crème</TITLE>
<PATH>bouffe/0144.xml</PATH>
<DATE><YEAR>2010</YEAR><MONTH>10</MONTH><DAY>25</DAY></DATE>
<CONTENT>
<SLIST>
  <ITEM>Préparation : 10 mn</ITEM>
  <ITEM>Cuisson en trois fois : 1h 15 environ</ITEM>
</SLIST>
<LINE/>
<BLIST><TITLE>Pour 4 personnes :</TITLE>
  <ITEM>1 petit chou blanc</ITEM>
  <ITEM>20g de beurre</ITEM>
  <ITEM>1 dl 1/2 de crème fraîche épaisse</ITEM>
  <ITEM>gros sel</ITEM>
  <ITEM>sel et poivre</ITEM>
</BLIST>
<LINE/>
<BLIST>
  <ITEM>Faites bouillir un faitout d'eau ; pendant ce temps, nettoyer le chou, coupez-le en huit, débarrassez le de la partie dure du cœur ; jetez les morceaux dans l'eau bouillante et laissez-le blanchir 5 minutes, puis égouttez-le, rafraîchissez-le sous l'eau froide, égouttez-le à nouveau.</ITEM>
  <ITEM>Jetez l'eau de blanchiment et faites bouillir à nouveau de l'eau ; ajoutez une poignée de gros sel, puis les morceaux de chou ; laissez cuire 35 minutes environ, puis égouttez à fond ; faites chauffer le four à 250°C.</ITEM>
  <ITEM>Beurrez un plat à gratin juste assez grand pour contenir les morceaux de chou, disposez-les dans le plat, nappez de crème fraîche, salez, poivrez, couvrez d'un papier aluminium, enfournez et laissez chauffer 15 minutes environ.</ITEM>
  <ITEM>Servez ce chou très chaud, par exemple avec des côtes de veau ou un poisson blanc poché.</ITEM>
  <ITEM>Vous pouvez remplacer la cuisson au four par la cuisson en cocotte ; vous pouvez aussi remplacer la crème par une béchamel légère, parsemer de gruyère râpé et de noisettes de beurre et faire gratiner.</ITEM>
</BLIST>
<I><U>source :</U> "Mon Bouquin de Cuisine" par Françoise Burgaud - page 343</I>
</CONTENT>
</PAGE>
