<?xml version="1.0"?>
<?xml-stylesheet type="text/xsl" href="../css/strict.xsl"?>
<PAGE xmlns:xsi="http://www.w3.org/2001/XMLSchema-instance" xsi:noNamespaceSchemaLocation="../css/schema.xsd">
<TITLE>petits g&#xE2;teaux aux carottes (Inde)</TITLE>
<PATH>bouffe/0157.xml</PATH>
<DATE><YEAR>2010</YEAR><MONTH>10</MONTH><DAY>25</DAY></DATE>
<CONTENT>

<SLIST>
<ITEM>Pr&#xE9;paration : 15 min</ITEM>
<ITEM>Cuisson : 30 &#xE0; 40 min</ITEM>
</SLIST>

<LINE/>

<BLIST><TITLE>Ingr&#xE9;dients :</TITLE>
<ITEM>500g de carottes</ITEM>
<ITEM>50g de raisins secs</ITEM>
<ITEM>40g de beurre</ITEM>
<ITEM>20g d'amandes effil&#xE9;es</ITEM>
<ITEM>3 gousses de cardamone</ITEM>
<ITEM>1 pinc&#xE9;e de 4 &#xE9;pices</ITEM>
<ITEM>90cl de lait</ITEM>
<ITEM>125g de sucre</ITEM>
<ITEM>20g de pistache</ITEM>
</BLIST>

<LINE/>

<BLIST>
<ITEM>&#xC9;plucher, laver et r&#xE2;per les carottes.</ITEM>
<ITEM>Faire chauffer le beurre dans une po&#xEA;le, y d&#xE9;poser les carottes et ajouter le lait et le sucre.</ITEM>
<ITEM>Faire cuire pendant 20 &#xE0; 30 min jusqu'&#xE0; ce que les carottes aient absorb&#xE9; tout le lait.</ITEM>
<ITEM>Ajouter les raisins secs puis faire cuire &#xE0; feu moyen pendant 10 min en remuant r&#xE9;guli&#xE8;rement avec une cuill&#xE8;re en bois.</ITEM>
<ITEM>Ouvrir les gousses de cardamome, r&#xE9;cup&#xE9;rer les graines et les &#xE9;craser ; les incorporer hors du feu avec les autres &#xE9;pices.</ITEM>
<ITEM>Laisser refroidir et d&#xE9;couper la p&#xE2;te en carr&#xE9;s ou en losanges.</ITEM>
<ITEM>D&#xE9;corer avec les amandes effil&#xE9;es ou les pistaches et servir ti&#xE8;de ou froid.</ITEM>
</BLIST>

<I><U>source :</U> "Carottes, je vous aime..." par B&#xE9;atrice Vigot-Lagandr&#xE9; - page 63</I>

</CONTENT>
</PAGE>
