<?xml version="1.0"?>
<?xml-stylesheet type="text/xsl" href="../css/strict.xsl"?>
<PAGE xmlns:xsi="http://www.w3.org/2001/XMLSchema-instance" xsi:noNamespaceSchemaLocation="../css/schema.xsd" xml:lang="fr">
<TITLE>Nice crumble</TITLE>
<PATH>bouffe/0122.xml</PATH>
<DATE><YEAR>2010</YEAR><MONTH>10</MONTH><DAY>25</DAY></DATE>
<CONTENT>
<SLIST>
  <ITEM>40 min de préparation</ITEM>
  <ITEM>30 min de cuisson</ITEM>
  <ITEM>30 min pour la ratatouille</ITEM>
</SLIST>
<LINE/>
<BLIST>
  <ITEM>1 kg de tomates</ITEM>
  <ITEM>1 belle aubergine</ITEM>
  <ITEM>3 courgettes bien fermes</ITEM>
  <ITEM>1 poivron rouge et 1 poivron vert</ITEM>
  <ITEM>1 oignon</ITEM>
  <ITEM>1 gousse d'ail</ITEM>
  <ITEM>3 cuil. à soupe d'huile d'olive</ITEM>
  <ITEM>thym, romarin</ITEM>
  <ITEM>sel, poivre</ITEM>
</BLIST>
miettes
<BLIST>
  <ITEM>150g de farine</ITEM>
  <ITEM>100g de beurre</ITEM>
  <ITEM>40g de pignons</ITEM>
  <ITEM>60g de parmesan râpé</ITEM>
  <ITEM>sel</ITEM>
</BLIST>
<LINE/>
<BLIST>
  <ITEM>Emincez l'oignon et hacher très finement l'ail après en avoir ôté le germe. Faire chauffer l'huile dans une cocotte et y faire revenir l'ail et l'oignon.</ITEM>
  <ITEM>Couper l'aubergine en petits en petits cubes et les mettre dans la cocotte. Lorsqu'ils sont bien dorés, ajouter les poivrons coupés en lanières. Assaisonner avec le thym et le romarin, du sel et du poivre. Au bout de 20 minutes, ajouter les courgettes coupées en rondelles et les tomates pelées et épépinées. Bien mélanger et maintenir une cuisson assez vive pour que les légumes rendent leur eau.</ITEM>
  <ITEM>Pendant ce temps, préchauffez le four thermostat 6 (180°C) et confectionner les miettes : mélanger du bout des doigts la farine, le parmesan et le beurre. Ajouter les pignons.</ITEM>
  <ITEM>Versez la ratatouille dans un plat et répartir les miettes dessus. Laisser cuire dans le four chaud pendant 20 à 30 minutes.</ITEM>
  <ITEM>Servir juste chaud avec du chèvre frais ou de fines tranches de mozzarella.</ITEM>
</BLIST>
<I><U>source :</U> "Crumbles" par Camille Le Foll - page 54</I>
</CONTENT>
</PAGE>