<?xml version="1.0"?>
<?xml-stylesheet type="text/xsl" href="../css/strict.xsl"?>
<PAGE status="unmaintained" xmlns:xsi="http://www.w3.org/2001/XMLSchema-instance" xsi:noNamespaceSchemaLocation="../css/schema.xsd" xml:lang="en">
<TITLE>MENSI</TITLE>
<PATH>links/mensi.xml</PATH>
<DATE><YEAR>2017</YEAR><MONTH>2</MONTH><DAY>8</DAY></DATE>
<CONTENT>
<BLIST><TITLE>Articles</TITLE>
<ITEM><ARTICLE><X protection="free_registration"><T>What Happened to That Bridge?</T><A>https://www.qualitydigest.com/inside/metrology-news/what-happened-bridge-080807.html</A><L>en</L><F>HTML</F></X><DATE><YEAR>2007</YEAR><MONTH>8</MONTH></DATE><COMMENT>Leica ScanStation is used for analysing a bridge collapse.</COMMENT></ARTICLE></ITEM>
</BLIST>
</CONTENT>
</PAGE>