<?xml version="1.0"?>
<?xml-stylesheet type="text/xsl" href="../css/strict.xsl"?>
<PAGE xmlns:xsi="http://www.w3.org/2001/XMLSchema-instance" xsi:noNamespaceSchemaLocation="../css/schema.xsd">
<TITLE>House</TITLE>
<PATH>links/house.xml</PATH>
<DATE><YEAR>2019</YEAR><MONTH>6</MONTH><DAY>10</DAY></DATE>
<CONTENT>
<BLIST>
  <ITEM><X><T>Demande de Valeur Foncière</T><A>https://app.dvf.etalab.gouv.fr</A><L>fr</L><F>HTML</F></X></ITEM>
  <ITEM><BLIST><TITLE>Real estate advertisements</TITLE>
    <ITEM><X><T>seloger.com</T><A>https://www.seloger.com/</A><L>fr</L><F>HTML</F></X></ITEM>
    <ITEM><X><T>paruvendu.fr</T><A>https://www.paruvendu.fr/</A><L>fr</L><F>HTML</F></X></ITEM>
    <ITEM><X><T>De Particulier A Particulier</T><A>https://www.pap.fr</A><L>fr</L><F>HTML</F></X></ITEM>
    <ITEM><X><T>a vendre a louer</T><A>https://www.avendrealouer.fr</A><L>fr</L><F>HTML</F></X></ITEM>
    <ITEM><X><T>Logic-immo.com</T><A>https://www.logic-immo.com/</A><L>fr</L><F>HTML</F></X></ITEM>
    <ITEM><X><T>leboncoin</T><A>https://www.leboncoin.fr/annonces/offres</A><L>fr</L><F>HTML</F></X></ITEM>
  </BLIST></ITEM>
  <ITEM><BLIST><TITLE>Agencies</TITLE>
    <ITEM><BLIST><TITLE>France</TITLE>
      <ITEM><X><T>FNAIM</T><A>https://www.fnaim.fr</A><L>fr</L><F>HTML</F></X></ITEM>
      <ITEM><X><T>SNPI</T><A>https://www.snpi.com/</A><L>fr</L><F>HTML</F></X></ITEM>
      <ITEM><X><T>Century 21</T><A>https://www.century21france.fr/</A><L>fr</L><F>HTML</F></X></ITEM>
      <ITEM><X><T>FONCIA</T><A>https://www.foncia.fr/</A><L>fr</L><F>HTML</F></X></ITEM>
      <ITEM><X><T>Batigère</T><A>https://www.batigere.fr</A><L>fr</L><F>HTML</F></X></ITEM>
      <ITEM><X><T>ORPI</T><A>https://www.orpi.com/</A><L>fr</L><F>HTML</F></X></ITEM>
      <ITEM><X><T>Nexity</T><A>https://www.nexity.fr</A><L>fr</L><F>HTML</F></X></ITEM>
      <ITEM><X><T>Guy Hoquet</T><A>https://www.guy-hoquet.com/</A><L>fr</L><F>HTML</F></X></ITEM>
    </BLIST></ITEM>
    <ITEM><BLIST><TITLE>Lorraine</TITLE>
      <ITEM><X><T>FNAIM Lorraine</T><A>http://www.fnaimlorraine.com/</A><L>fr</L><F>HTML</F></X></ITEM>
      <ITEM><X><T>Novadimm</T><A>http://www.novadimm.com/</A><L>fr</L><F>HTML</F></X></ITEM>
      <ITEM><X><T>Claude Rizzon</T><A>https://www.rizzon.com/</A><L>fr</L><F>HTML</F></X></ITEM>
      <ITEM><X><T>Liberty Home</T><A>https://www.libertyhome.fr/</A><L>fr</L><F>HTML</F></X></ITEM>
      <ITEM><BLIST><TITLE>Meurthe-et-Moselle</TITLE>
        <ITEM><X><T>Bonnabelle</T><A>http://www.bonnabelle.fr/</A><L>fr</L><F>HTML</F></X></ITEM>
        <ITEM><X><T>Cabinet Devaux</T><A>http://www.cabinetdevaux.com/</A><L>fr</L><F>HTML</F></X></ITEM>
        <ITEM><X><T>Alpha Conseil</T><A>https://www.alphaconseilimmobilier.com/</A><L>fr</L><F>HTML</F></X></ITEM>
        <ITEM><X><T>Joël Pierre Immobilier</T><A>https://www.century21-joelpierre-nancy.com/</A><L>fr</L><F>HTML</F></X></ITEM>
        <ITEM><X><T>Crepol</T><A>https://www.crepol.com/</A><L>fr</L><F>HTML</F></X></ITEM>
        <ITEM><X><T>Immobilier Conseil Debever</T><A>http://www.immoconseil-debever.com</A><L>fr</L><F>HTML</F></X></ITEM>
        <ITEM><X><T>Société Lorraine d'Habitat</T><A>https://www.lorraine-habitat.fr/</A><L>fr</L><F>HTML</F></X></ITEM>
      </BLIST></ITEM>
      <ITEM><BLIST><TITLE>Moselle</TITLE>
        <ITEM><X><T>Norman Parker</T><A>http://www.normanparker57.com</A><L>fr</L><F>HTML</F></X></ITEM>
      </BLIST></ITEM>
    <ITEM><BLIST><TITLE>Rhône-Alpes</TITLE>
      <ITEM><BLIST><TITLE>Drôme</TITLE>
        <ITEM><X><T>Les 2 Rives</T><A>https://www.les-2rives.fr/index.php</A><L>fr</L><F>HTML</F></X></ITEM>
      </BLIST></ITEM>
    </BLIST></ITEM>
    </BLIST></ITEM>
  </BLIST></ITEM>
</BLIST>
</CONTENT>
</PAGE>