<?xml version="1.0"?>
<?xml-stylesheet type="text/xsl" href="../css/strict.xsl"?>
<PAGE xmlns:xsi="http://www.w3.org/2001/XMLSchema-instance" xsi:noNamespaceSchemaLocation="../css/schema.xsd">
<TITLE>Spätzles</TITLE>
<PATH>bouffe/0133.xml</PATH>
<DATE><YEAR>2010</YEAR><MONTH>10</MONTH><DAY>25</DAY></DATE>
<CONTENT>
<SLIST>
  <ITEM>préparation : 15 min</ITEM>
  <ITEM>cuisson : 20 min</ITEM>
</SLIST>
<LINE/>
<BLIST><TITLE>Pour 6 personnes</TITLE>
  <ITEM>600g de farine</ITEM>
  <ITEM>60g de semoule de blé tendre</ITEM>
  <ITEM>6 œufs</ITEM>
  <ITEM>35g de sel fin</ITEM>
  <ITEM>gros sel</ITEM>
  <ITEM>beurre</ITEM>
</BLIST>
<LINE/>
<BLIST>
  <ITEM>Mélanger la farine, la semoule, les œufs, 22,5 cl d'eau et le sel. Passer cette masse à travers la grille à trous de votre moulin à légumes, dans une grande casserole d'eau bouillante salée.</ITEM>
  <ITEM>Quand les spätzles remontent, laisser cuire encore quelques minutes puis les refroidir dans de l'eau glacée. Bien les égoutter et, au moment de servir, les faire sauter au beurre.</ITEM>
</BLIST>
<I><U>source :</U> "Recettes gourmandes de nos terroirs - Alsace " - page 59</I>
</CONTENT>
</PAGE>
