<?xml version="1.0"?>
<?xml-stylesheet type="text/xsl" href="../css/strict.xsl"?>
<PAGE xmlns:xsi="http://www.w3.org/2001/XMLSchema-instance" xsi:noNamespaceSchemaLocation="../css/schema.xsd">
<TITLE>Scatter Diagram</TITLE>
<PATH>quality/scatter.xml</PATH>
<DATE><YEAR>2010</YEAR><MONTH>10</MONTH><DAY>25</DAY></DATE>
<CONTENT>
<BLIST><TITLE>Links</TITLE>
<ITEM><X><T>Wikipedia</T><A>https://en.wikipedia.org/wiki/Scatter_diagram</A><L>en</L><F>HTML</F></X></ITEM>
</BLIST>
</CONTENT>
</PAGE>