<?xml version="1.0"?>
<?xml-stylesheet type="text/xsl" href="../css/strict.xsl"?>
<PAGE xmlns:xsi="http://www.w3.org/2001/XMLSchema-instance" xsi:noNamespaceSchemaLocation="../css/schema.xsd" xml:lang="fr">
<TITLE>Sauce tomate classique et une variante</TITLE>
<PATH>bouffe/0128.xml</PATH>
<DATE><YEAR>2010</YEAR><MONTH>10</MONTH><DAY>25</DAY></DATE>
<CONTENT>
<SLIST>
  <ITEM>Préparation et cuisson : 40 mn environ</ITEM>
</SLIST>
<LINE/>
<BLIST><TITLE>Pour 5 à 6 personnes :</TITLE>
  <ITEM>500 g de tomates</ITEM>
  <ITEM>2 cuillerées à soupe de concentré de tomates</ITEM>
  <ITEM>20cl de vin blanc sec</ITEM>
  <ITEM>1 gros oignon</ITEM>
  <ITEM>2 gousses d'ail</ITEM>
  <ITEM>1 gros bouquet garni</ITEM>
  <ITEM>1 cuillerée à soupe d'huile d'olive</ITEM>
  <ITEM>1/2 cuillerée à café de sucre en poudre</ITEM>
  <ITEM>sel et poivre</ITEM>
</BLIST>
<LINE/>
<BLIST>
  <ITEM>Portez une casserole d'eau à ébullition ; plonger-y les tomates pendant 5 à 6 secondes, puis égouttez-les, pelez-les, retirez-en le cœur dur et hachez-les grossièrement ; pelez et hachez l'oignon ; épluchez et écrasez l'ail.</ITEM>
  <ITEM>Faites chauffez l'huile dans une casserole à fond épais ; mettez-y l'oignon ; faites-le blondir 2 ou 3 minutes en remuant, ajoutez les tomates et l'ail ; mélangez bien ; ajoutez ensuite le concentré de tomates et le vin blanc ; mélangez ; ajoutez enfin le sucre en poudre et le bouquet garni ; salez et poivrez ; portez à ébullition, puis faites cuire 25 minutes à petits frémissements en remuant de temps en temps.</ITEM>
  <ITEM>Quand la sauce est cuite, retirez-en le bouquet garni ; rectifiez l'assaisonnement ; servez la sauce telle quelle ou passez-la au mixer et faites-la réchauffer sur feu doux.</ITEM>
  <ITEM>Pour servir avec du poisson, vous pouvez ajouter à cette sauce 4 filets d'anchois réduits en purée et 1 cuillerée de câpres.</ITEM>
  <ITEM>En hiver, vous pouvez supprimer les tomates fraîches et utiliser 5 cuillerées à soupe de concentré de tomates.</ITEM>
</BLIST>
<I><U>source :</U> "Mon Bouquin de Cuisine" par Françoise Burgaud - page 1104</I>
</CONTENT>
</PAGE>